,isi,judul,link
0,"KONTAN.CO.ID - JAKARTA. Harga emas batangan bersertifikat Antam keluaran Logam Mulia PT Aneka Tambang Tbk (ANTM) turun pada Sabtu (12/2).Mengutip situs Logam Mulia, harga pecahan satu gram emas Antam berada di Rp 940.000. Harga emas Antam ini turun dari harga Kamis (11/2) sebesar Rp 945.000 per gram.Sementara harga buyback emas Antam juga tetap berada di level Rp 820.000 per gram, turun Rp 5.000 dari harga buyback pada Kamis (11/2) yang ada di Rp 825.000 per gram. Baca Juga: Tak berubah, harga emas Antam hari ini tetap di Rp 945.000 per gram, Kamis (11/2)Berikut harga emas batangan Antam dalam pecahan lainnya per Sabtu (13/2) dan belum termasuk pajak:Keterangan:Logam Mulia Antam menjual emas dan perak batangan dalam beberapa ukuran berat (misalnya 1 gram, 2 gram, dan 500 gram). Biasanya harga per gram emas Antam akan berbeda tergantung berat batangnya. Perbedaan ini terjadi karena ada biaya tambahan untuk pencetakan, sehingga harga per gram emas Antam batang kecil lebih mahal dari batang yang lebih besar. Harga yang ada di sini adalah harga per gram emas batang 1 kilogram yang biasa dijadikan patokan pelaku bisnis emas. ","Harga emas Antam hari ini turun Rp 5.000 ke level Rp 940.000 per gram, Sabtu (13/2)",https://investasi.kontan.co.id/news/harga-emas-antam-hari-ini-turun-rp-5000-ke-level-rp-940000-per-gram-sabtu-132
1,"KONTAN.CO.ID - JAKARTA. Indeks Harga Saham Gabungan (IHSG) menguat 20,69 poin atau 0,33% ke level 6.222,52 pada Kamis (11/2). Kenaikan IHSG ini memperkokoh penguatan IHSG selama sepekan atau periode 8-11 Februari 2021. Menurut data RTI Business, pekan ini IHSG cenderung bergerak di zona hijau, hanya perdagangan hari Selasa (9/2) pergerakannya lesu. Adapun IHSG tercatat naik 1,15% dari penutupan perdagangan Jumat (5/2) yang berada di level 6.151,73.Analis Pilarmas Investindo Sekuritas Okie Ardiastama mengatakan, penguatan IHSG pekan ini beriringan dengan sentimen eksternal, diantaranya penguatan dari harga komoditas dan indeks pasar global. Sementara, sentimen positif dari dalam negeri masih minim. Oleh karena itu, IHSG cenderung bergerak terbatas pekan ini.Sementara, Analis MNC Sekuritas Herditya Wicaksana menyebut, penguatan IHSG pekan ini sudah diperkirakan sebelumnya. Secara teknikal, IHSG memang masih berpotensi menguat menguji level 6.250 hingga 6.330.Baca Juga: IHSG bisa capai 6.880 tahun ini, Mirae Asset targetkan nilai transaksi saham naik 17%""Pergerakan IHSG cenderung inline dengan yang kami perkirakan. Di sisi lain, pergerakan IHSG ini juga sedikit banyak dipengaruhi bursa global yang sepekan ini bergerak mixed cenderung menguat,"" ujarnya kepada Kontan.co.id, Kamis (11/2).Ia pun memperkirakan, penguatan IHSG masih akan berlanjut pekan depan, 14-19 Februari 2021. Namun, investor tetap perlu memperhatikan level resistance terdekat di area 6.285. Apabila IHSG mampu menembus level tersebut, bukan tidak mungkin IHSG bergerak menuju level 6.300.Namun, jika gagal menembus level tersebut maka IHSG akan bergerak sideways dengan support terdekat 6.069. Herditya memproyeksikan, pergerakaan IHSG pekan depan akan berada di rentang 6.150 hingga 6.250 terlebih dahulu.Sementara itu, Okie memperkirakan, IHSG akan bergerak cenderung melemah terbatas di level 6.090 hingga 6.286. Beberapa sentimen yang berpotensi mempengaruhi pergerakan IHSG adalah Rapat Dewan Gubernur (RDG) Bank Indonesia (BI) pada 17-18 Februari 2021 yang akan menentukan tingkat suku bunga acuan.Selain itu, IHSG juga akan terpengaruh oleh hasil dari neraca perdagangan.  ","Penguatan IHSG berpotensi lanjut pekan depan, cermati sentimen yang membayangi",https://investasi.kontan.co.id/news/penguatan-ihsg-berpotensi-lanjut-pekan-depan-cermati-sentimen-yang-membayangi
2,"KONTAN.CO.ID - JAKARTA. PT Buyung Poetra Sembada Tbk (HOKI) akan melakukan pemecahan nilai nominal saham atau stock split dengan rasio 1:4. Aksi korporasi tersebut telah mengantongi restu pemegang saham dalam Rapat Umum Pemegang Saham Luar Biasa (RUPSLB) yang digelar pada Rabu (27/1). Mengutip ketebukaan informasi, Kamis (11/2), berikut ini jadwal realisasi stock split emiten produsen beras bermerek Topi Koki itu:Baca Juga: Buyung Poetra Sembada (HOKI) kejar pertumbuhan kinerja hingga 15% pada tahun 2021Asal tahu saja, dengan perbandingan 1:4, nilai nominal yang semula Rp 100 per saham menjadi Rp 25 per saham. Direktur PT Buyung Poetra Sembada Tbk Budiman Susilo sempat mengungkapkan sebelumnya, aksi stock split dilakukan agar saham HOKI lebih terjangkau bagi investor, terutama investor ritel. Mengingat, jumlah investor ritel di bursa sedang bertumbuh saat ini. Selain itu, stock split diharapkan dapat mendorong likuiditas saham HOKI menjadi lebih baik.  ","Buyung Poetra Sembada (HOKI) akan stock split dengan rasio 1:4, berikut jadwalnya",https://investasi.kontan.co.id/news/buyung-poetra-sembada-hoki-akan-stock-split-dengan-rasio-14-berikut-jadwalnya
3,"KONTAN.CO.ID - JAKARTA. Dengan tidak adanya perdagangan pada hari ini, Jumat (12/2), rupiah di pasar spot berhasil mengakhiri perdagangan pekan ini dengan kinerja yang memuaskan. Pada perdagangan kemarin, Kamis (11/2), rupiah ditutup menguat 0,09% ke Rp 13.970 per dolar Amerika Serikat (AS). Sementara jika dihitung dalam sepekan, rupiah sudah catatkan penguatan sebesar 0,33%.Kondisi yang berbeda justru terjadi di kurs tengah Bank Indonesia (BI). Rupiah ditutup di Rp 14.011 per dolar AS atau melemah 0,16%. Walau begitu, jika dihitung dalam sepekan, mata uang Garuda ini masih berhasil catatkan penguatan 0,36%.Baca Juga: Mayoritas bursa Asia terjebak jeda liburan, bitcoin melesatHead of Economics Research Pefindo Fikri C Permana mengatakan, sepekan ini sentimen utama yang mendorong penguatan rupiah adalah melemahnya dolar AS. Salah satu faktornya adalah sikap The Fed yang masih tetap dovish membuat kinerja dolar AS pun tertekan.“Apalagi, stimulus dari Joe Biden juga sudah terealisasikan yang pada akhirnya semakin membuat indeks dolar AS melemah. Di satu sisi, harga komoditas terus membaik yang akan mendorong negara-negara yang fokus ekspornya adalah komoditas berpotensi mengalami perbaikan kinerja ekspor, termasuk Indonesia,” kata Fikri ketika dihubungi Kontan.co.id, Kamis (11/2).Lebih lanjut, Fikri memperkirakan, dengan nilai ekspor yang membaik, neraca perdagangan Indonesia akan kembali surplus pada akhir bulan nanti. Selanjutnya, cadangan devisa Indonesia pun semakin membaik dan berujung pada kinerja rupiah yang juga membaik.Sementara untuk pekan depan, sentimen dari Indonesia masih akan seputar pertambahan kasus positif Covid-19 serta efektivitas PPKM. Di satu sisi, Fikri menilai rupiah yang berpotensi mendapat katalis positif dari hasil lelang Surat Berharga Negara (SBN).Baca Juga: Simak rekomendasi analis NH Korindo memilih saham murah di indeks Kompas100“Saat ini dengan yield SBN yang 10 tahun ada di kisaran 6,2%, sebenarnya sangat menarik bagi investor asing. Oleh karena itu, ada potensi investor asing yang masuk ke lelang SBN akan lebih tinggi dari biasanya, apalagi dengan kinerja rupiah yang terjaga belakangan ini,” tambahnya.Fikri memperkirakan, sepekan ke depan rupiah akan bergerak pada rentang Rp 13.900 - Rp 14.100 per dolar AS.  ",Simak proyeksi pergerak rupiah untuk pekan depan,https://investasi.kontan.co.id/news/simak-proyeksi-pergerak-rupiah-untuk-pekan-depan-1
4,"KONTAN.CO.ID - JAKARTA. Rupiah di pasar spot berhasil menguat dalam sepekan ini. Pada perdagangan Kamis (11/2), rupiah ditutup menguat 0,07% ke Rp 13.973 per dolar Amerika Serikat (AS). Alhasil, jika dihitung dalam sepekan, rupiah menguat sebesar 0,33%.Sementara itu, di kurs tengah Bank Indonesia (BI) rupiah ditutup di Rp 14.011 per dolar AS pada Kamis (11/2)  atau melemah 0,16%. Namun, jika dihitung dalam sepekan, mata uang Garuda ini masih berhasil menguat 0,36%.Head of Economics Research Pefindo Fikri C Permana mengatakan, untuk pekan depan, rupiah berpotensi mendapat katalis positif dari hasil lelang Surat Berharga Negara (SBN).“Saat ini dengan yield SBN yang 10 tahun ada di kisaran 6,2%, sebenarnya sangat menarik bagi investor asing. Oleh karena itu, ada potensi investor asing yang masuk ke lelang SBN akan lebih tinggi dari biasanya, apalagi dengan kinerja rupiah yang terjaga belakangan ini,” katanya saat dihubungi Kamis(11/2).Baca Juga: Usai menguat 0,33% dalam sepekan, bagaimana prospek rupiah pada pekan depan?Selain itu, sentimen yang mewarnai pergerakan rupiah dari dalam negeri pada pekan depan masih akan seputar pertambahan kasus positif Covid-19 serta efektivitas PPKM. Fikri memperkirakan, sepekan ke depan rupiah akan bergerak pada rentang Rp 13.900 - Rp 14.100 per dolar AS. Asal tahu saja, dalam sepekan ini sentimen utama yang mendorong penguatan rupiah adalah melemahnya dolar AS. Salah satu faktornya adalah sikap The Fed yang masih tetap dovish membuat kinerja dolar AS tertekan.“Apalagi, stimulus dari Joe Biden juga sudah terealisasikan yang pada akhirnya semakin membuat indeks dolar AS melemah. Di satu sisi, harga komoditas terus membaik yang akan mendorong negara-negara yang fokus eskpornya adalah komoditas berpotensi mengalami perbaikan kinerja ekspor, termasuk Indonesia,” kata Fikri.Fikri memperkirakan, dengan nilai ekspor yang membaik, neraca perdagangan Indonesia akan kembali surplus pada akhir bulan nanti. Selanjutnya, cadangan devisa Indonesia pun semakin membaik dan berujung pada kinerja rupiah yang juga membaik. ","Rupiah menguat 0,33% dalam sepekan, begini prospeknya untuk pekan depan",https://investasi.kontan.co.id/news/rupiah-menguat-033-dalam-sepekan-begini-prospeknya-untuk-pekan-depan-1
